{
  "slug": "external-engineers-without-losing-control",
  "category": "buyer-questions",
  "topic_area": "capacity",
  "industry": "all",
  "question": "Should you hire in-house or extend your engineering team?",
  "title": "How to bring external engineers into your team without losing control",
  "hook": "The roadmap is agreed and the funding is in, but the two engineers you need are still not hired. In Eurostat's last two surveys, more than half of EU companies recruiting tech specialists had the same problem.",
  "lead": "Bring external engineers into your team when a roadmap item, a missing skill or a test of a new direction cannot wait for hiring, and hire in-house for work that stays core to your product for years. You keep control by agreeing the people, the access and the exit before anyone starts.",
  "tldr": [
    "57.5% of EU enterprises that tried to recruit information and communication technology (ICT) specialists in 2023 found vacancies hard to fill.",
    "Hire in-house for long-term product knowledge, a clear role and enough time to choose well.",
    "Bring in external engineers when the work is urgent, needs a skill you lack, or is still uncertain.",
    "The real risk of extending is losing control, so agree the people, the access and the exit first.",
    "Handing over a whole defined area is a third option when you want one owner for an outcome."
  ],
  "published": "2026-10-28",
  "updated": "2026-10-28",
  "review_by": "2027-10-28",
  "seo": {
    "primary_query": "external engineers",
    "secondary_queries": [
      "staff augmentation",
      "team extension vs hiring",
      "extend engineering team",
      "hire developers in-house"
    ],
    "query_source": "topic-list",
    "meta_title": "How to bring in external engineers without losing control",
    "meta_description": "Bring in external engineers when work cannot wait for hiring, and keep control by agreeing the people, access and exit first. With a comparison table."
  },
  "sections": [
    {
      "heading": "Why is hiring engineers in-house so slow in Europe?",
      "answer": "Hiring is slow because engineering roles are hard to fill: in 2023, 57.5% of EU enterprises that recruited or tried to recruit ICT specialists had difficulties filling the vacancies, according to [Eurostat](https://ec.europa.eu/eurostat/statistics-explained/index.php?title=ICT_specialists_-_statistics_on_hard-to-fill_vacancies_in_enterprises).",
      "paragraphs": [
        "It is not a one-off. In Eurostat's previous survey, covering 2021, the share was 62.8%, according to [Eurostat's 2023 news release](https://ec.europa.eu/eurostat/web/products-eurostat-news/w/ddn-20230712-1).",
        "The share is higher in Germany and Austria. Eurostat reports 72.41% for Germany and 67.26% for Austria in the same year.",
        "The reasons are not only a lack of people. For Austrian enterprises that recruited or tried to recruit ICT specialists, the greatest difficulties were a lack of applications (82%), a lack of professional experience (72%) and applicants' high salary expectations (62%), according to [Statistics Austria](https://www.statistik.at/fileadmin/announcement/2025/01/20250127IKTFachkraefteUnternehmen2024EN.pdf).",
        "A hard-to-fill vacancy rarely stays a hiring problem. It becomes a roadmap problem: the feature waits, other engineers cover the gap, and the team loses focus on what matters most."
      ],
      "takeaway": "Plan the roadmap on the people you have today, and treat every open role as a date you cannot rely on.",
      "based_on": [
        "src:eurostat-ict-vacancies",
        "src:eurostat-ict-2021",
        "src:statistik-austria-ict"
      ]
    },
    {
      "heading": "When should you bring in external engineers instead of hiring?",
      "answer": "Bring in external engineers when the need is urgent, specific or uncertain: a roadmap item that cannot slip, a skill your team does not have, or a direction you want to test before committing to permanent roles.",
      "paragraphs": [
        "Team extension means adding external engineers who work inside your team, your process and your tools, while you keep control of the product. Our [Staff Augmentation model](https://thecodest.co/en/services/staff-augmentation/) works this way. It adds capacity and skills, but adding a person does not fix an organisational problem, such as unclear priorities or missing product ownership.",
        "SupplierPlus, an invoice financing platform based in Tallinn, is one example. It needed a secure platform for digital documents, electronic signatures and automatic data exchange, and [brought in a team of Ruby developers](https://thecodest.co/en/case-studies/providing-a-team-of-ruby-developers-for-a-fintech-company/) from The Codest to build it.",
        "Extension also works as a bridge. The extended team carries the roadmap while you hire, then hand over context to the people you bring in. Start with one bounded piece of work, and expand when it is working."
      ],
      "takeaway": "Write down why the need cannot wait. If you cannot name the deadline or the missing skill, hiring may be the better route.",
      "based_on": [
        "case:supplierplus",
        "codest:https://thecodest.co/en/services/staff-augmentation/"
      ]
    },
    {
      "heading": "When is hiring in-house the better choice?",
      "answer": "Hire in-house when the work is core to your product for years, when the knowledge must stay inside the company, and when the role is clear enough to hire for well.",
      "bullets": [
        {
          "bold": "Core, long-lived knowledge.",
          "text": "The people who own your architecture and product direction should usually be on your payroll."
        },
        {
          "bold": "A stable, well-defined role.",
          "text": "If you can describe the job for the next two years, you can hire for it."
        },
        {
          "bold": "Time to choose well.",
          "text": "A rushed permanent hire is harder to undo than an external engineer who is not the right fit."
        }
      ],
      "paragraphs": [
        "Expect the search to take effort. In the same Statistics Austria release, 72% of recruiting enterprises named a lack of qualifications as a difficulty, so a role that needs a rare skill is the hardest kind to hire for.",
        "Hiring is also how a team builds its own culture and standards. An extended team can follow and strengthen them, but they should not be the only people who hold them."
      ],
      "based_on": [
        "src:statistik-austria-ict",
        "general"
      ]
    },
    {
      "heading": "How do hiring, team extension and handing over an area compare?",
      "answer": "Hiring gives you the most control and the slowest start, team extension adds capacity inside your own process, and handing over a defined area makes one external owner responsible for an agreed outcome.",
      "table": {
        "caption": "Three ways to add engineering capacity",
        "columns": [
          "Option",
          "Best when",
          "Main risk",
          "Agree before you start"
        ],
        "rows": [
          [
            "Hire in-house",
            "The role is core, stable and worth waiting for",
            "The roadmap waits while the vacancy stays open",
            "Which work pauses until the hire starts"
          ],
          [
            "Extend your team",
            "Work is urgent, needs a missing skill, or is still uncertain",
            "Losing control of who works on what",
            "Who joins, how work is reviewed, how you scale down"
          ],
          [
            "Hand over a defined area",
            "You want one owner for a whole product area or system",
            "Unclear scope and success criteria",
            "Scope, success criteria, reporting and the exit plan"
          ]
        ]
      },
      "paragraphs": [
        "The real difference is who is responsible for what. When you hire, you own everything. When you extend your team, you own the product and the outcome, and the partner owns selection, quality, onboarding and continuity of its engineers. When you hand over an area, the partner owns discovery, architecture, delivery and maintenance, as agreed.",
        "The third option fits when you need an outcome rather than extra people. A major logistics company, for example, [built a custom logistics platform](https://thecodest.co/en/case-studies/transforming-logistics-with-a-custom-digital-platform/) with The Codest to automate manual order processing and route planning. The same model applies to a payment platform or a marketplace module.",
        "That is the [Product Development](https://thecodest.co/en/services/product-development/) model. We do not promise business results we are not measuring together, so agree the success criteria first."
      ],
      "takeaway": "Choose the model by the decision you need to make, not by the day rate. The cheapest option per month can be the most expensive per outcome.",
      "based_on": [
        "case:transforming-logistics",
        "codest:https://thecodest.co/en/services/product-development/",
        "src:eurostat-ict-vacancies"
      ]
    },
    {
      "heading": "What are the risks of extending your team, and how do you reduce them?",
      "answer": "The main risk of extending your team is losing control: people you did not choose, work you cannot see, and knowledge that leaves with the vendor. Agree the people, the access and the exit before anyone starts.",
      "bullets": [
        {
          "bold": "The team in the pitch is not the team that delivers.",
          "text": "The fix: meet and interview the engineers who will do the work, before you sign."
        },
        {
          "bold": "Work happens out of sight.",
          "text": "The fix: the engineers work in your repository, tools and rituals, not in a separate queue."
        },